title,series,rating,language,genres,bookFormat,pages,publisher,publishDate,awards,numRatings,ratingsByStars,likedPercent,setting,Year,Author,Num_Customers_Rated,Price
The Casual Vacancy,,3.3,English,"['Fiction', 'Contemporary', 'Mystery', 'Adult', 'Adult Fiction', 'Drama', 'Unfinished', 'British Literature', 'Novels', 'Audiobook']",Hardcover,503,"Little, Brown and Company",September 27th 2012,['Goodreads Choice Award for Fiction (2012)'],302889,"['50685', '90207', '89332', '44776', '27889']",76.0,['Pagford (United Kingdom)'],2012.0,J.K. Rowling,9729.0,16.95
The Catcher in the Rye,,3.81,English,"['Classics', 'Fiction', 'Young Adult', 'Literature', 'School', 'Novels', 'Coming Of Age', 'American', 'High School', 'Read For School']",Paperback,277,Back Bay Books,01/30/01,"['Teen Read Award Nominee for Best All-Time-Fave (2010)', 'National Book Award Finalist for Fiction (1952)']",2736523,"['937208', '846027', '579292', '234980', '139016']",86.0,"['New York City, New York (United States)', 'Agerstown, Pennsylvania (United States)']",2010.0,J. D. Salinger,14641.0,6.82
The Checklist Manifesto: How to Get Things Right,,4.05,,"['Nonfiction', 'Business', 'Medicine', 'Self Help', 'Productivity', 'Medical', 'Science', 'Psychology', 'Personal Development', 'Management']",Kindle Edition,225,,December 15th 2009,[],48512,"['17241', '19430', '9396', '1917', '528']",95.0,[],2010.0,Atul Gawande,3812.0,23.8
The Choice,Daughters of the Moon #9,4.01,English,"['Young Adult', 'Fantasy', 'Mythology', 'Paranormal', 'Supernatural', 'Urban Fantasy', 'Teen', 'Fiction', 'Magic', 'Romance']",Hardcover,288,Volo,April 14th 2003,[],4195,"['1617', '1292', '1041', '206', '39']",94.0,"['Los Angeles, California (United States)']",,Edith Eger,,
The Complete Ketogenic Diet for Beginners: Your Essential Guide to Living the Keto Lifestyle,,3.62,,"['Cookbooks', 'Nonfiction', 'Health', 'Cooking', 'Reference', 'Food', 'Self Help', 'Diets', 'Nutrition', 'Fitness']",Paperback,158,Rockridge Press,December 20th 2016,[],6159,"['1822', '1832', '1343', '651', '511']",81.0,[],2017.0,Amy Ramos,18251.0,6.99
The Day the Crayons Came Home,Crayons,4.39,English,"['Picture Books', 'Childrens', 'Humor', 'Fiction', 'Art', 'Fantasy', 'Storytime', 'Adventure', 'Kids', 'School']",Hardcover,48,Philomel Books,August 18th 2015,['Goodreads Choice Award for Picture Books (2015)'],13486,"['7738', '3935', '1340', '299', '174']",96.0,[],2015.0,Drew Daywalt,3189.0,12.02
The Day the Crayons Quit,Crayons,4.42,English,"['Picture Books', 'Childrens', 'Humor', 'Fiction', 'Art', 'Fantasy', 'Storytime', 'School', 'Kids', 'Juvenile']",Hardcover,30,Philomel Books,June 27th 2013,"[""Vermont's Picture Book Awards: Red Clover (2015)"", 'Texas Bluebonnet Award (2015)', 'Zilveren Griffel (2015)', 'South Carolina Book Award for Picture Book (2016)', ""Flicker Tale Children's Book Award for Picture Books (2015)"", 'Keystone to Reading Book Award for Primary (2015)', 'California Young Readers Medal for Primary (2016)', 'Wanda Gág Read Aloud Book Award (2014)', 'Monarch Award (2015)', 'Goodreads Choice Award for Picture Books (2013)', 'The Magnolia Award for K-2 (2015)', ""CBI Book of the Year for Children's Choice (2014)"", 'Hea Lasteraamat (2015)']",44747,"['27558', '11250', '3997', '1146', '796']",96.0,[],2016.0,Drew Daywalt,11445.0,9.19
The Definitive Book of Body Language,,3.98,English,"['Psychology', 'Nonfiction', 'Self Help', 'Communication', 'Business', 'Science', 'Personal Development', 'Reference', 'Sociology', 'Social']",Hardcover,400,Bantam,July 25th 2006,[],22326,"['7794', '8271', '4750', '1109', '402']",93.0,[],,Allan Pease,,
The Diary of a Bookseller,,3.78,English,"['Nonfiction', 'Books About Books', 'Memoir', 'Biography', 'Scotland', 'Biography Memoir', 'Audiobook', 'Humor', 'Contemporary', 'Autobiography']",Hardcover,310,Profile Books,September 28th 2017,[],15147,"['3628', '6136', '4078', '1020', '285']",91.0,"['Wigtown, Galloway, Scotland']",,Shaun Bythell,,
The Diary of a Young Girl,,4.15,English,"['Nonfiction', 'Classics', 'History', 'Biography', 'Memoir', 'Historical', 'Holocaust', 'Autobiography', 'War', 'World War II']",Mass Market Paperback,283,Bantam,07/28/93,['Luisterboek Award Nominee (2008)'],2741134,"['1266466', '859538', '438340', '112847', '63943']",94.0,['Amsterdam (Netherlands)'],,Anne Frank,,
The Dot,Creatrilogy,4.2,English,"['Picture Books', 'Art', 'Childrens', 'Fiction', 'Inspirational', 'Realistic Fiction', 'School', 'Growth Mindset', 'Storytime', 'Teaching']",Hardcover,32,Candlewick Press,September 15th 2003,"['Borders Original Voices Award for Picture Books (2003)', 'Irma Black Award Nominee (2004)']",27505,"['14984', '6496', '3618', '1285', '1122']",91.0,[],,Peter H. Reynolds,,
The Fault in Our Stars,,4.21,English,"['Young Adult', 'Romance', 'Fiction', 'Contemporary', 'Realistic Fiction', 'Teen', 'Coming Of Age', 'Drama', 'Novels', 'Love']",Hardcover,313,Dutton Books,01/10/12,"['Georgia Peach Book Award (2013)', 'Buxtehuder Bulle (2012)', 'Odyssey Award (2013)', 'Audie Award for Teens (2013)', ""West Australian Young Readers' Book Award (WAYRBA) for Older Readers (2013)"", ""Pennsylvania Young Readers' Choice Award for Young Adults (2013)"", 'Rhode Island Teen Book Award (2014)', 'Evergreen Teen Book Award (2015)', 'Soaring Eagle Book Award (2014)', 'Milwaukee County Teen Book Award (2013)', 'Indies Choice Book Award for Young Adult (2013)', 'Deutscher Jugendliteraturpreis for Preis der Jugendjury (2013)', 'Amelia Elizabeth Walden Award (2013)', 'Dioraphte Jongerenliteratuurprijs for vertaald boek en publieksprijs (2013)', 'The Inky Awards for Silver Inky (2012)', 'California Young Readers Medal for Young Adult (2015)', 'Lincoln Award (2014)', 'Luisterboek Award (2015)', 'Goodreads Choice Award for Young Adult Fiction (2012) and Nominee for Best of the Best  (2018)', 'Green Mountain Book Award (2014)', 'The Inky Awards Shortlist for Silver Inky (2012)', ""Louisiana Teen Readers' Choice (2015)"", 'Missouri Gateway Readers Award (2015)', 'Oklahoma Sequoyah Award for High School (2015)', 'Alabama Author Award for Young Adult (2013)', 'Premio El Templo de las Mil Puertas for Mejor novela extranjera independiente (2012)', 'FAB Award Nominee (2014)', 'Premi Protagonista Jove for Categoria 15-16 anys (2013)']",3550714,"['1784471', '1022406', '512574', '150365', '80898']",93.0,"['Indianapolis, Indiana (United States)', 'Amsterdam (Netherlands)']",2014.0,John Green,52613.0,12.99
The Five Dysfunctions of a Team: A Leadership Fable,,4.06,English,"['Business', 'Leadership', 'Nonfiction', 'Management', 'Self Help', 'Buisness', 'Personal Development', 'Psychology', 'Entrepreneurship', 'Audiobook']",Hardcover,227,Jossey-Bass,April 11th 2002,[],79305,"['31349', '28676', '13991', '3349', '1940']",93.0,[],2015.0,Patrick Lencioni,3792.0,19.54
The Girl Who Drank the Moon,,4.1,English,"['Fantasy', 'Middle Grade', 'Fiction', 'Young Adult', 'Childrens', 'Magic', 'Audiobook', 'Dragons', 'Witches', 'Juvenile']",Hardcover,388,Algonquin Young Readers,August 9th 2016,"['Newbery Medal (2017)', 'Locus Award Nominee for Best Young Adult Book (2017)', 'Texas Bluebonnet Award Nominee (2018)', ""Dorothy Canfield Fisher Children's Book Award Nominee (2018)"", 'Andre Norton Award Nominee (2016)', ""William Allen White Children's Book Award Nominee (2019)"", 'NCTE Charlotte Huck Honor Book (2017)']",54401,"['22612', '19543', '8701', '2388', '1157']",93.0,[],,Kelly Barnhill,,
The Girl on the Train,,3.93,English,"['Fiction', 'Mystery', 'Thriller', 'Crime', 'Mystery Thriller', 'Suspense', 'Contemporary', 'Adult', 'Audiobook', 'Adult Fiction']",Hardcover,325,Riverhead Books,01/13/15,"['ITW Thriller Award Nominee for Best Hardcover Novel (2016)', 'Audie Award for Audiobook of the Year (2016)', 'Australian Book Industry Award (ABIA) Nominee for International Book (2016)', 'Goodreads Choice Award for Mystery & Thriller (2015)', 'Waterstones Book of the Year Nominee (2015)', ""Woman & Home Reader's Choice Award for Best Thriller Of The Year (2016)""]",2111336,"['689572', '802603', '444058', '123620', '51483']",92.0,"['London, England', 'England']",2016.0,Paula Hawkins,82328.0,0.25
The Giver,The Giver #1,4.13,English,"['Young Adult', 'Fiction', 'Classics', 'Dystopia', 'Science Fiction', 'Fantasy', 'School', 'Childrens', 'Middle Grade', 'Read For School']",Paperback,208,Ember,01/24/06,"['Newbery Medal (1994)', ""Mythopoeic Fantasy Award Nominee for Children's Literature (1994)"", 'Golden Duck Award for Young Adult (Hal Clement Award) (1994)', 'Garden State Book Award for Teen Fiction Grades 6-8 (1996)', ""Buckeye Children's Book Award for Grade 6-8 (1997)"", 'Grand Canyon Reader Award for Teen Book (1995)', 'Maryland Black-Eyed Susan Book Award for Grade 6-9 (1995)', 'Golden Sower Award for Young Adult (1995)', ""Pennsylvania Young Readers' Choice Award for Grades 3-8 (1995)"", 'Soaring Eagle Book Award Nominee (1996)', ""Pacific Northwest Library Association Young Reader's Choice Award for Senior (1996)"", 'Boston Globe-Horn Book Award Nominee for Fiction (1993)', 'New Mexico Land of Enchantment Award (1997)', 'Eliot Rosewater Indiana High School Book Award (1997)', ""William Allen White Children's Book Award (1996)"", 'Wyoming Indian Paintbrush Nominee (1996)', ""NSK Neustadt Prize for Children's Literature Nominee (2013)"", 'Oklahoma Sequoyah Award for YA (1996)', ""Rebecca Caudill Young Readers' Book Award (1996)"", 'Hea Lasteraamat (2010)', 'Premi Protagonista Jove for Categoria 13-14 anys (2016)', 'Margaret A. Edwards Award (2007)']",1785054,"['786988', '591426', '293684', '77858', '35098']",94.0,[],,Lois Lowry,,
The Giver of Stars,,4.28,English,"['Historical Fiction', 'Fiction', 'Audiobook', 'Historical', 'Romance', 'Adult', 'Adult Fiction', 'Book Club', 'Books About Books', 'Chick Lit']",Hardcover,388,Pamela Dorman Books,October 8th 2019,['Goodreads Choice Award Nominee for Historical Fiction (2019)'],183231,"['83114', '74275', '21046', '3460', '1336']",97.0,"['Baileyville, Kentucky (United States)']",,Jojo Moyes,,
The Giving Tree,,4.37,English,"['Childrens', 'Picture Books', 'Classics', 'Fiction', 'Poetry', 'Young Adult', 'Fantasy', 'Juvenile', 'Kids', 'Short Stories']",Hardcover,64,HarperCollins Publishers,10/07/64,[],905731,"['556142', '204347', '94819', '27950', '22473']",94.0,[],2019.0,Shel Silverstein,15066.0,1.7
The Grand Design,,4.04,English,"['Science', 'Nonfiction', 'Physics', 'Philosophy', 'Popular Science', 'Astronomy', 'Audiobook', 'Religion', 'History', 'Space']",Hardcover,199,Bantam,September 7th 2010,[],63503,"['24361', '23324', '11524', '2726', '1568']",93.0,[],2010.0,Stephen Hawking,2006.0,19.95
The Great Gatsby,,3.92,English,"['Classics', 'Fiction', 'School', 'Literature', 'Historical Fiction', 'Romance', 'Novels', 'Read For School', 'High School', 'American']",Paperback,200,Scribner,09/28/04,['Grammy Award Nominee for Best Spoken Word Album (2003)'],3775504,"['1345866', '1266424', '798955', '252115', '112144']",90.0,"['New York City, New York (United States)', 'New York State (United States)', 'Long Island, New York (United States)']",2012.0,F. Scott Fitzgerald,10819.0,8.74
The Greater Journey: Americans in Paris,,3.92,English,"['History', 'Nonfiction', 'France', 'Biography', 'American History', 'Travel', 'Art', 'Historical', 'Audiobook', '19th Century']",Hardcover,558,Simon & Schuster Adult Publishing Group,May 24th 2011,"['Andrew Carnegie Medal Nominee for Nonfiction (2012)', 'Marfield Prize (National Award for Arts Writing) Nominee (2011)', 'Goodreads Choice Award Nominee for History & Biography (2011)']",17862,"['5702', '6840', '3881', '1015', '424']",92.0,['France'],2011.0,David McCullough,1204.0,33.0
The Gruffalo,Gruffalo #1,4.47,English,"['Picture Books', 'Childrens', 'Animals', 'Fiction', 'Fantasy', 'Poetry', 'Monsters', 'Storytime', 'Classics', 'Humor']",Paperback,32,MacMillan Children's Books,August 1st 1999,"['Blue Peter Book Award for Best Book to Read Aloud (2000)', 'Nestlé Smarties Book Prize for 0–5 years (1999)']",30755,"['19516', '7424', '2825', '652', '338']",97.0,[],,Julia Donaldson,,
The Guardians,,3.68,English,"['Science Fiction', 'Young Adult', 'Fiction', 'Dystopia', 'Fantasy', 'Novels', 'School', '20th Century', 'British Literature', 'Childrens']",Mass Market Paperback,214,Collier,1972,"[""Guardian Children's Fiction Prize (1971)"", 'Deutscher Jugendliteraturpreis for Jugendbuch (1976)']",608,"['137', '218', '183', '59', '11']",88.0,[],,John Grisham,,
The Guernsey Literary and Potato Peel Pie Society,,4.17,English,"['Historical Fiction', 'Fiction', 'Historical', 'Romance', 'World War II', 'Book Club', 'War', 'Adult', 'Adult Fiction', 'Books About Books']",Paperback,291,Dial Press,07/10/18,"['Indies Choice Book Award for Best Indie Buzz Book (Fiction) (2009)', 'LovelyBooks Leserpreis Nominee for Allgemeine Literatur (2009)']",610392,"['266691', '220413', '91717', '22141', '9430']",95.0,"['United Kingdom', 'Guernsey']",2010.0,Mary Ann Shaffer,10026.0,0.94
The Guest Cat,,3.53,English,"['Fiction', 'Japan', 'Japanese Literature', 'Cats', 'Contemporary', 'Animals', 'Asia', 'Novels', 'Literary Fiction', 'Asian Literature']",Paperback,140,New Directions,January 28th 2014,[],16689,"['2599', '6136', '5842', '1752', '360']",87.0,['Tokyo (Japan)'],,Takashi Hiraide,,
The Handmaid's Tale,The Handmaid's Tale #1,4.11,English,"['Fiction', 'Classics', 'Dystopia', 'Science Fiction', 'Feminism', 'Fantasy', 'Adult', 'Audiobook', 'Literature', 'Novels']",Paperback,314,Anchor Books,04/28/98,"['Booker Prize Nominee (1986)', 'Nebula Award Nominee for Best Novel (1986)', 'Locus Award Nominee for Best SF Novel (1987)', 'Arthur C. Clarke Award (1987)', 'Audie Award for Fiction (2013)', 'Los Angeles Times Book Prize for Fiction (1986)', 'Prometheus Award Nominee for Best Novel (1987)', 'James Tiptree Jr. Award Nominee for Retrospective (1995)', ""Governor General's Literary Awards / Prix littéraires du Gouverneur général for Fiction (1985)"", 'SF Chronicle Award Nominee for Novel (1987)', ""Commonwealth Writers' Prize Nominee for Best Book in Caribbean and Canada (1987)"", 'CBC Canada Reads Nominee (2002)', 'Metų verstinė knyga Nominee (2012)']",1459245,"['616810', '517007', '227994', '64441', '32993']",93.0,"['Cambridge, Massachusetts (United States)', 'Republic of Gilead']",2017.0,Margaret Atwood,37046.0,7.99
The Harbinger: The Ancient Mystery that Holds the Secret of America's Future,The Harbinger #1,3.96,English,"['Christian', 'Fiction', 'Christian Fiction', 'Religion', 'Christianity', 'Mystery', 'Faith', 'Spirituality', 'Historical Fiction', 'Theology']",Paperback,262,Frontline,January 3rd 2012,[],21572,"['9461', '5708', '3709', '1517', '1177']",88.0,[],2013.0,Jonathan Cahn,13690.0,2.25
The Hate U Give,The Hate U Give #1,4.52,English,"['Young Adult', 'Fiction', 'Contemporary', 'Audiobook', 'Realistic Fiction', 'Race', 'Social Justice', 'Teen', 'Young Adult Contemporary', 'African American']",Hardcover,444,Balzer + Bray,02/28/17,"[""National Book Award Nominee for Young People's Literature (2017)"", 'Odyssey Award (2018)', 'William C. Morris YA Debut Award (2018)', 'Los Angeles Times Book Prize Nominee for Young Adult Literature (2017)', 'Edgar Award Nominee for Best Young Adult (2018)', 'Michael L. Printz Award Nominee (2018)', 'Rhode Island Teen Book Award (2019)', 'Evergreen Teen Book Award Nominee for High School (2020)', 'Coretta Scott King Book Award Nominee for Author Honor (2018)', 'Deutscher Jugendliteraturpreis for Preis der Jugendjury (2018)', 'Amelia Elizabeth Walden Award (2018)', 'Boston Globe-Horn Book Award for Fiction (2017)', 'Lincoln Award (2019)', ""Waterstones Children's Book Prize for Overall and Older Fiction (2018)"", ""Kirkus Prize Nominee for Young Readers' Literature (2017)"", 'Goodreads Choice Award for Young Adult Fiction & for Debut Goodreads Author (2017) and for Best of the Best  (2018)', 'Carnegie Medal Nominee (2018)', 'NAACP Image Award Nominee for Youth/Teens (2018)']",503674,"['319950', '139056', '34099', '6668', '3901']",98.0,"['United States of America', 'Garden Heights']",2018.0,Angie Thomas,14315.0,8.65
The Help,,4.47,English,"['Fiction', 'Historical Fiction', 'Historical', 'Adult', 'Adult Fiction', 'Contemporary', 'Audiobook', 'Classics', 'Chick Lit', 'Book Club']",Hardcover,451,Amy Einhorn Books/G.P. Putnam's Sons,02/10/09,"['Orange Prize Nominee for Fiction Longlist (2010)', 'Audie Award for Fiction (2010)', 'Exclusive Books Boeke Prize (2009)', 'SIBA Book Award for Fiction (2010)', 'Indies Choice Book Award for Adult Debut (2010)', 'Puddly Award for Fiction (2011)', 'Lincoln Award Nominee (2013)', 'Grand Prix des lectrices de Elle for roman (2011)', 'Goodreads Choice Award for Fiction (2009) and Nominee for Best of the Best  (2018)', 'Townsend Prize for Fiction (2010)']",2164011,"['1300564', '636115', '176679', '34643', '16010']",98.0,"['Jackson, Mississippi (United States)', 'Jackson, Mississippi (United States)', 'Mississippi (United States)']",2011.0,Kathryn Stockett,14772.0,14.97
The Hunger Games,The Hunger Games #1,4.33,English,"['Young Adult', 'Fiction', 'Dystopia', 'Fantasy', 'Science Fiction', 'Romance', 'Adventure', 'Teen', 'Post Apocalyptic', 'Action']",Hardcover,374,Scholastic Press,09/14/08,"['Locus Award Nominee for Best Young Adult Book (2009)', 'Georgia Peach Book Award (2009)', 'Buxtehuder Bulle (2009)', 'Golden Duck Award for Young Adult (Hal Clement Award) (2009)', ""Grand Prix de l'Imaginaire Nominee for Roman jeunesse étranger (2010)"", 'Books I Loved Best Yearly (BILBY) Awards for Older Readers (2012)', ""West Australian Young Readers' Book Award (WAYRBA) for Older Readers (2010)"", ""Red House Children's Book Award for Older Readers & Overall (2010)"", 'South Carolina Book Award for Junior and Young Adult Book (2011)', 'Charlotte Award (2010)', 'Colorado Blue Spruce Young Adult Book Award (2010)', 'Teen Buckeye Book Award (2009)', ""Pennsylvania Young Readers' Choice Award for Young Adults (2010)"", 'Rhode Island Teen Book Award (2010)', ""Dorothy Canfield Fisher Children's Book Award (2010)"", 'Evergreen Teen Book Award (2011)', 'Soaring Eagle Book Award (2009)', 'Milwaukee County Teen Book Award Nominee (2010)', 'Sakura Medal for Middle School Book (2010)', 'Michigan Library Association Thumbs Up! Award (2009)', 'Florida Teens Read (2009)', 'Deutscher Jugendliteraturpreis for Preis der Jugendjury (2010)', 'Iowa High School Book Award (2011)', 'New Mexico Land of Enchantment Award for Young Adult (2011)', 'Eliot Rosewater Indiana High School Book Award (2010)', 'The Inky Awards for Silver Inky (2009)', 'California Young Readers Medal for Young Adult (2011)', 'Lincoln Award (2011)', 'Kinderboekwinkelprijs (2010)', 'Missouri Truman Readers Award (2011)', 'CYBILS Award for Young Adult Fantasy & Science Fiction (2008)', 'Literaturpreis der Jury der jungen Leser for Jugendbuch (2010)', 'The Inky Awards Shortlist for Silver Inky (2009)', 'Prix Et-lisez-moi (2011)', 'Missouri Gateway Readers Award (2011)', 'Oklahoma Sequoyah Award for High School and Intermediate (2011)', 'Premio El Templo de las Mil Puertas for Mejor novela extranjera perteneciente a saga (2009)', ""Rebecca Caudill Young Readers' Book Award (2011)"", 'LovelyBooks Leserpreis for Fantasy (2009)', 'LovelyBooks Leserpreis for Bestes Cover/Umschlag (2009)', 'Premi Protagonista Jove for Categoria 13-14 anys (2010)']",6376780,"['3444695', '1921313', '745221', '171994', '93557']",96.0,"['District 12, Panem', 'Capitol, Panem', 'Panem (United States)']",2012.0,Suzanne Collins,34046.0,9.96
The Immortal Life of Henrietta Lacks,,4.07,English,"['Nonfiction', 'Science', 'History', 'Biography', 'Medicine', 'Audiobook', 'Book Club', 'Medical', 'Biography Memoir', 'Historical']",Hardcover,370,Crown Publishing Group,February 2nd 2010,"['Ambassador Book Award for American Studies (2011)', 'Audie Award for Nonfiction (2011)', 'Chicago Tribune Heartland Prize for Nonfiction (2010)', 'Wellcome Book Prize (2010)', 'Puddly Award for Nonfiction (2011)', 'Goodreads Choice Award for  Nonfiction and Debut Author and Nominee for Favorite Book (2010)', 'AAAS/Subaru SB&F Prize for Excellence in Science Books for Young Adult Science Book (2011)']",587187,"['238511', '210677', '94444', '25799', '17756']",93.0,"['Baltimore, Maryland (United States)', 'Clover, Virginia (United States)']",2012.0,Rebecca Skloot,11378.0,0.94
The Infinite Game,,4.22,,"['Business', 'Nonfiction', 'Leadership', 'Self Help', 'Personal Development', 'Management', 'Audiobook', 'Psychology', 'Philosophy', 'Buisness']",Hardcover,272,Portfolio,October 15th 2019,[],8188,"['3709', '2977', '1185', '242', '75']",96.0,[],,Simon Sinek,,
The Intelligent Investor,,4.23,English,"['Finance', 'Business', 'Nonfiction', 'Economics', 'Money', 'Personal Finance', 'Self Help', 'Buisness', 'Personal Development', 'Reference']",Paperback,623,Harper Business,February 21st 2006,[],80719,"['40888', '24579', '10305', '2821', '2126']",94.0,[],,Benjamin Graham,,
The Invention of Hugo Cabret,,4.22,English,"['Historical Fiction', 'Fiction', 'Young Adult', 'Childrens', 'Graphic Novels', 'Middle Grade', 'Fantasy', 'Mystery', 'Historical', 'Picture Books']",Hardcover,533,Scholastic Press,03/28/07,"['Caldecott Medal (2008)', ""Book Sense Book of the Year Award for Children's Literature (2008)"", ""Flicker Tale Children's Book Award (2009)"", ""Dorothy Canfield Fisher Children's Book Award Nominee (2009)"", 'Deutscher Jugendliteraturpreis Nominee for Kinderbuch (2009)', ""Iowa Children's Choice Award (2010)"", ""Boston Author's Club Young Reader Award (2008)"", ""NAIBA Book of the Year for Children's Literature (2007)"", ""National Book Award Finalist for Young People's Literature (2007)"", ""Rebecca Caudill Young Readers' Book Award Nominee (2009)"", 'لاک\u200cپشت پرنده for نشان طلایی (2012)']",162904,"['77330', '54165', '23792', '5289', '2328']",95.0,['Paris (France)'],2011.0,Brian Selznick,1778.0,17.29
The Invention of Wings,,4.24,English,"['Historical Fiction', 'Fiction', 'Historical', 'Book Club', 'Audiobook', 'Adult Fiction', 'Adult', 'Novels', 'African American', 'Southern']",Hardcover,384,Viking,January 7th 2014,"['Florida Book Award for General Fiction - Gold (2014)', 'Goodreads Choice Award Nominee for Historical Fiction (2014)', 'International Dublin Literary Award Nominee (2016)']",263623,"['114842', '107431', '33773', '5446', '2131']",97.0,"['Charleston, South Carolina (United States)']",2014.0,Sue Monk Kidd,15174.0,20.98
The Jolly Christmas Postman,The Jolly Postman,4.49,English,"['Christmas', 'Picture Books', 'Childrens', 'Holiday', 'Fiction', 'Fantasy', 'Humor', 'Fairy Tales', 'Writing', 'Poetry']",Hardcover,64,Little Brown & Co (Juv),September 1st 2001,['Kate Greenaway Medal (1991)'],3531,"['2293', '799', '346', '60', '33']",97.0,[],,Allan Ahlberg,,
The Last Wish,The Witcher #0.5,4.13,English,"['Fantasy', 'Fiction', 'Short Stories', 'High Fantasy', 'Audiobook', 'Magic', 'Adult', 'Adventure', 'Polish Literature', 'Epic Fantasy']",Kindle Edition,360,Orbit,December 14th 2008,"['Premio Ignotus for Mejor antología (2003)', 'Tähtifantasia Award (2011)']",190952,"['74685', '77090', '30710', '5992', '2475']",96.0,[],,Andrzej Sapkowski,,
The Laws of Human Nature,,4.39,,"['Psychology', 'Nonfiction', 'Philosophy', 'Self Help', 'History', 'Personal Development', 'Business', 'Audiobook', 'Leadership', 'Sociology']",Kindle Edition,624,Viking,October 23rd 2018,[],6724,"['3918', '1843', '704', '175', '84']",96.0,[],,Robert Greene,,
The Life-Changing Magic of Tidying Up: The Japanese Art of Decluttering and Organizing,Magic Cleaning #1,3.84,English,"['Nonfiction', 'Self Help', 'Audiobook', 'Personal Development', 'Psychology', 'Japan', 'How To', 'Adult', 'Productivity', 'Reference']",Hardcover,213,Ten Speed Press,October 14th 2014,[],279060,"['87635', '96062', '67288', '20499', '7576']",90.0,[],2018.0,Marie Kondō,24520.0,0.94
The Litigators,,3.81,English,"['Fiction', 'Thriller', 'Mystery', 'Legal Thriller', 'Crime', 'Audiobook', 'Suspense', 'Mystery Thriller', 'Law', 'Adult Fiction']",Audio,,Random House Audio,October 25th 2011,[],64275,"['14854', '27176', '18148', '3411', '686']",94.0,"['Chicago, Illinois (United States)']",2011.0,John Grisham,6870.0,16.71
The Little Prince,,4.31,English,"['Classics', 'Fiction', 'Fantasy', 'Childrens', 'France', 'Young Adult', 'Philosophy', 'Literature', 'French Literature', 'Middle Grade']",Paperback,93,"Harcourt, Inc.",06/29/00,['Retro Hugo Award for Best Novella (2019)'],1363048,"['765471', '352384', '170246', '50086', '24861']",95.0,[],,Antoine de Saint-Exupery,,
The Longest Ride,,4.15,English,"['Romance', 'Fiction', 'Chick Lit', 'Contemporary', 'Adult', 'Audiobook', 'Adult Fiction', 'Contemporary Romance', 'Drama', 'Realistic Fiction']",Hardcover,398,Grand Central Publishing,September 17th 2013,"['Audie Award for Romance (2014)', 'Goodreads Choice Award Nominee for Romance (2013)']",112204,"['47929', '39691', '19095', '4208', '1281']",95.0,[],2013.0,Nicholas Sparks,11311.0,22.26
The Lost Causes of Bleak Creek,,3.7,English,"['Horror', 'Fiction', 'Mystery', 'Thriller', 'Young Adult', 'Fantasy', 'Mystery Thriller', 'Audiobook', 'Humor', 'Adult']",Hardcover,326,Crown,October 29th 2019,['Goodreads Choice Award Nominee for Horror (2019)'],9582,"['2957', '3112', '1897', '905', '711']",83.0,['North Carolina (United States)'],,Rhett McLaughlin,,
The Magnolia Story,,4.19,English,"['Nonfiction', 'Biography', 'Memoir', 'Audiobook', 'Autobiography', 'Biography Memoir', 'Christian', 'Adult', 'Inspirational', 'Business']",Kindle Edition,208,Thomas Nelson,October 18th 2016,[],82243,"['39383', '26476', '11133', '2957', '2294']",94.0,[],2016.0,Chip Gaines,8634.0,13.46
